movie_id,movie_name,year,certificate,runtime,genre,rating,description,director
tt11528750,South by Southwest,2021,,,Thriller,8.5,An aspiring actor comes to LA to search for his former girlfriend only to be terrorized by a trio of thugs searching for diamonds hidden in a calculus textbook they believe is in his apartment.,Steve Custodio
tt25401564,Birds at Night,2023,,70 min,Thriller,8.5,A mysterious new street drug gives users violent reactions.,Mike Ellwood
tt2369196,Broken Glass,2013,,96 min,"Drama, Mystery, Thriller",8.5,A dramatic thriller that revolves around a man who must sort through his mind's tricks in order to unlock the mystery of his past.,Daniel R. Chavez
tt0186597,Tagos ng dugo,1987,TV-MA,136 min,"Crime, Drama, Thriller",8.5,"A young Pina was traumatized when her family was murdered while she had her first menstruation. She has grown up into a serial killer, transforming herself to different personalities as she...                See full summary »",Maryo J. de los Reyes
tt8875804,Gangs of North East,2017,,114 min,Thriller,8.5,"The story of the film revolves around the life of a teenage girl Margaret and her single mother Rosy in the majestic land of Shillong, and how everything changes when fate has got something else for them, reconnecting their past.",Rupak Gogoi
tt11841860,Where Is She?,2020,,,Thriller,8.5,"A woman goes missing after a volatile argument with her alcoholic boyfriend. As two detectives set out to crack this case by eliminating suspects, unusual happenings present themselves along the way.",Lemarze Smith
tt15085276,A Curious Tale,2021,,50 min,"Horror, Mystery, Thriller",8.5,A musician takes time out to do some archeology and seeks out the hiding place along the Sussex coast of a lost fabled crown that supposedly helps protect Great Britain against invasion.,Leigh Tarrant
tt12814530,"Theoretically, a paranoid conspiratorial phone call",2020,,92 min,"Action, Adventure, Comedy",8.5,"When it is the time to shape reality, the spy world calls The Pro Bono Spy Hunter.",Jorge Luis Villacorta Santamato
tt5933040,The Composer,2019,,90 min,"Comedy, Crime, Drama",8.5,The Composer - a dark Parody about a kidnap that goes wrong.,Alon Newman
tt5605580,Je pan kahish e sachuj kahish,2016,,104 min,Thriller,8.5,"Leeza and Dhaval meet at a coffee shop to enjoy their day together at Dhaval's place,They are not aware that this day is going to be their biggest nightmare forever!What happens in the ...                See full summary »",Naiteek Ravval
tt12451380,Chhupam Chhaai,2016,,94 min,"Adventure, Drama, Family",8.5,"In a small town in the heart of India, six teenage friends who secretly run ""Friends Private Detective Agency,"" encounter their most challenging case; a murder mystery.",Pratik Mittal
tt1124335,One Minutes,2009,,75 min,"Comedy, Crime, Drama",8.5,An anthology of one minute films in every genre imaginable.,Philip Pugh
tt20324566,Kandhidi Nodana,2022,,124 min,Thriller,8.5,A Challenging Suspense Thriller which gives you a brainstorming twist which is indeed unpredictable and makes you not take off your eyes.,S.K. Nagendra Urs
tt15354966,Lovers,2020,,72 min,"Action, Comedy, Drama",8.5,"Justin Fisher tries to get the girl of his dream, Bailey. Meanwhile he also has to deal with the normal high school drama and more.",Connor Hearn
tt6772188,I May Regret,2018,,100 min,Thriller,8.5,An older woman suffering from dementia is convinced that her young live-in nurse is out to kill her and take her life's fortune. But people are not always who we think they are. And dementia has a way of unraveling the truth.,Graham Streeter
tt6213262,The Murderers,2017,,89 min,"Drama, Thriller",8.5,"After discovering the past has caught up with him, a retired hit-man returns to his former territory to face his demons and lay them to rest.",Will' Terran
tt13422364,Throw Everything Into Play,2020,,80 min,Thriller,8.5,A 12-year-old boy that dreams of being a baseball player must put his entire life on hold after he witnesses a vicious crime.,Alfredo Marron
tt10014616,Obstáculos Orgullo Y Recompensa,2019,,,"Crime, Thriller, Western",8.5,Add a Plot,John Lopez
tt21083296,Final Hours of a Suffering Artist,2022,,70 min,"Drama, Thriller",8.5,"August, a severely depressed writer isolates himself inside of his studio to look back at his life and try to understand his condition before killing himself. His daughter Cate, and his ...                See full summary »",John Taylor Timmons
tt4598720,Glass,2016,,71 min,"Drama, Mystery, Thriller",8.5,"""Glass"" Is a film about a young man, Atlas, and his continuous struggle with early-onset Alzheimer's. Seen through his eyes, his life is a puzzle he desperately tries to piece together. His...                See full summary »",James Powell
tt10133066,Swayamvada,2019,,131 min,"Drama, Thriller",8.5,"Swayamvada is a psychological thriller centered on a rare disease which inflicts pain not only on the affected, but also the family members of the affected. The movie explores the love of ...                See full summary »",Verma Vivek
tt5154194,Dark Illusion,2014,,,Thriller,8.5,"Alkis is an introverted photographer with a disorder of personality. Despite the strong relationship he has developed with his mother, he reaches in despair due to the tension that exists ...                See full summary »",Manos Karystinos
tt13387734,The Darkest Night,2013,,78 min,Thriller,8.5,"A young girl witnesses her friend's murder. The killer realizes that he has been seen. A long hunt begins that will last all night, ending in an out of service hotel where the truth of what happened will be revealed.",Salvatore Vitiello
tt5372134,Blood Painting,2016,,76 min,"Action, Mystery, Thriller",8.5,"Twenty years after their father shot himself, leaving blood on his final piece of artwork, brothers Shawn and Tim still cope with the ongoing pain and trauma",Andrew Rotondi
tt1592260,Lost in a Crowd,2011,,92 min,"Drama, Thriller",8.5,"Ethan is in a major slump; he's unemployed, isolated and just plain confused. After his friends drag him out, another ""night out"" spirals into a whirlwind of events that will forever change all of their lives.",Micah Cohen
tt1776258,Never Feed the Troll,2010,Not Rated,77 min,Thriller,8.5,"Linda has a past she'd rather forget, but an online intruder decides he wants things differently and imposes a night of terror on her.",Jet Eller
tt13475494,The Inner,2020,,61 min,"Horror, Thriller",8.5,"A man named Michael sets up these experiments to show the public his paranormal inner friends, but little does he know that he accidently summoned something demonic that is now among him",Elijah Butler
tt15772306,Preludes/Beginnings,2021,,47 min,"Horror, Thriller",8.5,Whispers of the past and present come together in the darkness of the theater in this Emmy-nominated dance film performed by Ballet Austin and filmed on-site at the haunted Scottish Rite Theater.,Paul Michael Bloodgood
tt4499246,Jalebi,2013,,52 min,"Comedy, Thriller",8.5,"A struggling theater artist must avail the ultimate opportunity and find a way to fulfill his ever lasting dream to become a star, But he does not know where fate takes him with every step he takes.",Shajee Hasan
tt6907750,Yoxlama,2007,,,"Adventure, Comedy, Thriller",8.5,An inspector of the Ministry of Taxes with incredible memorization and calculation ability chases a company accused of tax fraud to avenge his friend.,Vagif Mustafayev
tt5116212,Homecoming,2016,,90 min,"Comedy, Drama, Mystery",8.5,"Abel returns home after graduating and working in the US for 10 years and joins the Tanzanian corporate world where his ethics and morals are tested, and forced to make choices about the person he wants to become.",Seko Shamte
tt15767978,Buy 1 Get 1 Free,2021,,135 min,Thriller,8.5,"Two twins con people and make a living in the city, an unknown call takes to them historical place and encounter with Manmatha changes their life forever.",Harish Anilgod
tt2396154,Rock Bottom Creek,2012,,,"Comedy, Horror, Thriller",8.5,"When a stressed couple decide that a weekend road trip could revive their battered courtship, an unpredictable series of luckless mishaps turn a reserved town into a personal hell.","Steve Balewicz, 
M.C. Nowell"
tt1612610,Natural Demise,2010,Not Rated,90 min,"Horror, Thriller",8.5,"Because people aren't perfect, Jesse Lincoln takes matters into his own hands by using his abilities and demon, but perfectionist behavior, to carve and butcher and then wire his victims ...                See full summary »",Richard Ryan
tt0402459,The Quiet Storm,2004,,150 min,Thriller,8.5,A politically charged full-length action thriller revolving around a gang of four. At a Pan-African meeting it's decided that for there to be a positive change in the social and economic ...                See full summary »,Shango Bsang
tt0790780,Die Wahrheit über das Volk der Mäuse,2006,,56 min,"Drama, Thriller",8.5,Add a Plot,Alexander Weimer
tt9436648,Marconi,2019,,,"Fantasy, Mystery, Thriller",8.5,"A young desperate writer traps in his own possessed book for his self centered nature, and an inanimate object tries to teach him a beautiful lesson.",Prudhvi Chand
tt6464498,John Blazer,2017,,104 min,Thriller,8.5,"John Blazer is a 21 californian guy with a dark and mysterious past. After winning a big sum of money at Lottery, he decides to have a party with friends and he will wake up in an abandoned...                See full summary »",Michele Rocchi
tt1587865,The Art of Power,2010,,104 min,"Drama, Thriller",8.5,"The Art of Power is a suspense thriller about three unassuming young adults living in Washington D.C., whose lives are thrust into a twisted saga. The story follows an odd loner, Wesley, ...                See full synopsis »",Nathanael Sherfield
tt1339080,Empty Fuller,2008,,89 min,"Drama, Romance, Thriller",8.5,"David Fuller is trapped in a life of deadening sameness. His only solace is the world he dives into when he reads a book. Friendless, isolated - he is disconnected from the world in a way ...                See full summary »",Brian Cwikla
tt2602732,Lunch Break,2013,,,"Action, Crime, Drama",8.5,"When the charms of a waitress make a hit-man doubt the life he has chosen, he catches a glimpse of the life that will never be.",Gabriel Schmidt
tt4526858,Elizabeth,2015,,,Thriller,8.5,Add a Plot,Brad Scriffiano
tt5866950,War of the Limelight,2016,,,"Drama, Romance, Thriller",8.5,A love story between a Syrian refugee and the son of a Mexican illegal immigrant takes place amidst an ongoing racism- and classism-fueled war between two rival high schools.,Eric Hinwood
tt0823649,The Life o'Simon,2008,,75 min,Thriller,8.5,Add a Plot,"Rupert Owen, 
Travis Sutherland"
tt9872052,Eight,2018,,88 min,Thriller,8.5,Add a Plot,Vinsent Mettel
tt0462249,Dead in Texas,2005,R,80 min,"Action, Comedy, Thriller",8.5,"The film follows the lives of two bank robbing brothers who's car breaks down in the middle of the desert, they eventually come to a small town called HELLUGO. As they continuously fail ...                See full summary »",Michael Anton
tt7286456,Joker,2019,R,122 min,"Crime, Drama, Thriller",8.4,A mentally troubled stand-up comedian embarks on a downward spiral that leads to the creation of an iconic villain.,Todd Phillips
tt0364569,Oldboy,2003,R,120 min,"Action, Drama, Mystery",8.4,"After being kidnapped and imprisoned for fifteen years, Oh Dae-Su is released, only to find that he must find his captor in five days.",Park Chan-wook
tt0209144,Memento,2000,R,113 min,"Mystery, Thriller",8.4,A man with short-term memory loss attempts to track down his wife's murderer.,Christopher Nolan
tt0090605,Aliens,1986,R,137 min,"Action, Adventure, Sci-Fi",8.4,"Fifty-seven years after surviving an apocalyptic attack aboard her space vessel by merciless space creatures, Officer Ripley awakens from hyper-sleep and tries to warn anyone who will listen about the predators.",James Cameron
tt0091251,Come and See,1985,Not Rated,142 min,"Drama, Thriller, War",8.4,"After finding an old rifle, a young boy joins the Soviet resistance movement against ruthless German forces and experiences the horrors of World War II.",Elem Klimov
tt0405094,The Lives of Others,2006,R,137 min,"Drama, Mystery, Thriller",8.4,"In 1984 East Berlin, an agent of the secret police, conducting surveillance on a writer and his lover, finds himself becoming increasingly absorbed by their lives.",Florian Henckel von Donnersmarck
tt19800020,88,2022,,122 min,Thriller,8.4,The Financial Director for a democratic super PAC behind a frontrunner presidential candidate investigates donations uncovering a conspiracy.,Eromose
tt0051201,Witness for the Prosecution,1957,Approved,116 min,"Crime, Drama, Mystery",8.4,A veteran British barrister must defend his client in a murder trial that has surprise after surprise.,Billy Wilder
tt0057565,High and Low,1963,Not Rated,143 min,"Crime, Drama, Mystery",8.4,An executive of a Yokohama shoe company becomes a victim of extortion when his chauffeur's son is kidnapped by mistake and held for ransom.,Akira Kurosawa
tt12361178,Drishyam 2,2021,,152 min,"Crime, Drama, Thriller",8.4,A gripping tale of an investigation and a family which is threatened by it. Will Georgekutty be able to protect his family this time?,Jeethu Joseph
tt12805686,The Consultant,2022,,97 min,Thriller,8.4,A psychiatrist relives all of his past fears with the arrival of three new patients.,Ignacio Maiso
tt5959980,Vada Chennai,2018,Not Rated,164 min,"Action, Crime, Drama",8.4,A young carrom player in north Chennai becomes a reluctant participant in a war between two warring gangsters.,Vetrimaaran
tt5875460,How I Got There,2022,,135 min,"Action, Thriller",8.4,"Two best friends from childhood stumble on a shipment of guns, they seize a once in a lifetime opportunity to get rich quick. Way over their heads, their wild ride takes a dangerous turn ...                See full summary »",Zeyad Alhusaini
tt4987556,Thani Oruvan,2015,Not Rated,160 min,"Action, Crime, Thriller",8.4,"Siddharth Abimanyu, an influential scientist, is involved in various illegal medical practices. Mithran, an efficient IPS officer, decides to expose him.",Mohan Raja
tt0072190,Sonar Kella,1974,Not Rated,136 min,"Adventure, Family, Mystery",8.4,"A young boy becomes a target for crooks, after he claims to remember his past life and mentions precious jewels in a golden fortress.",Satyajit Ray
tt0364647,Virumandi,2004,Not Rated,175 min,"Action, Drama, Thriller",8.4,A temperamental farmer gets embroiled in a bloody clan feud in a southern Tamil Nadu village.,Kamal Haasan
tt0050322,Do Ankhen Barah Haath,1957,,143 min,"Comedy, Crime, Drama",8.4,"Progressive, reform-minded young warden gets permission to take six surly murderers from prison to dilapidated country farm, to rehabilitate it and themselves through hard work and kindly guidance.",Shantaram Rajaram Vankudre
tt3394420,Ulidavaru Kandanthe,2014,Not Rated,154 min,"Crime, Drama, Thriller",8.4,"A journalist sets out to uncover the truth behind an incident, through the perspectives of different people, unraveling how they and their lives are intertwined with it.",Rakshit Shetty
tt13562536,Interview with the Antichrist,2020,,100 min,Thriller,8.4,A live interview with the Antichrist is broadcast to 2 billion people during the final year of the Great Tribulation.,Timothy A. Chey
tt9849644,Mind Thief,2022,,,"Comedy, Mystery, Sci-Fi",8.4,"A novelist realizes that her neighbors may be under the control of unknown forces. Little does she realize how close and sinister its influence has become. A harrowing, darkly humorous journey through the depths of the human psyche.",Matt Steinauer
tt4429128,Papanasam,2015,Not Rated,179 min,"Crime, Drama, Thriller",8.4,Desperate measures are taken by a man who tries to save his family from the dark side of the law after they commit an unexpected crime.,Jeethu Joseph
tt10370116,Single Slipper Size - 7,2019,,120 min,"Drama, Thriller",8.4,An emotionally unstable murder suspect explains the modus operandi behind the crimes he had committed to a few cops which helps in unfolding some intriguing revelation.,Parthiban Radhakrishnan
tt0051693,H-8...,1958,,105 min,"Drama, Thriller",8.4,A bus and a truck are destined to collide with each other on a highway. Their passengers go on about their lives without knowing what will happen.,Nikola Tanhofer
tt0220656,Mudhalvan,1999,Not Rated,169 min,"Action, Drama, Thriller",8.4,"A man accepts a challenge to act as the Chief Minister of Tamil Nadu for one day only, and makes such a success of it that soon he is embroiled in political intrigue.",S. Shankar
tt11209784,Atcham Thavir,2018,,,"Comedy, Thriller",8.4,"A group of friends with a pair of twin sisters, make their days for an event of their friend's destiny wedding far away, through the journey back from the wedding, everyone has their ...                See full summary »","Vikneshwaran Subramaniam S.S., 
Karthik Shamalan"
tt16350546,Tanuja,2022,,110 min,"Drama, Thriller",8.4,"Tanuja made news when she travelled 400 km to appear for the NEET examination on 14/10/2020. She was supported by Hon. CM, B. S. Yediyurappa and the minister of health and family welfare Dr. Sudhakar to acquire Medical education.",Harish M.D. Halli
tt15708792,Fragile Seeds,2021,,91 min,"Drama, Thriller",8.4,"The dramatic thriller Fragile Seeds follows Ryann Temple, a therapist working with sex offenders who uncovers haunting secrets in her family's past through the disturbed men she counsels ...                See full summary »",Joseph Boutilier
tt19893758,Shekar,2022,,131 min,"Action, Drama, Thriller",8.4,"A retired police officer with adept investigative skills, accidentally gets involved in a crime case after his ex-wife's unexpected demise.",Jeevitha Rajashekhar
tt2224139,Doppelsauger: El Misterio de Sara,2014,,,"Horror, Thriller",8.4,"Special Agent Ramirez must solve the disappearance of a young woman. The clues lead him to the business of white slavery as a prime suspect, a man with a double life. When the case seems to...                See full summary »",Alejandro Alvariño
tt11841830,Black Rose,2020,,120 min,Thriller,8.4,A mystery of a murder that never happened.,Hemant N Mishra
tt6354856,Ankhi O Tar Bondhura,2017,,114 min,"Adventure, Drama, Family",8.4,The film tells the story of a visually challenged girl and her friends who support her to express & enhance her talents and their adventure,Morshedul Islam
tt6862016,The Expat,2021,,,Thriller,8.4,A PTSD-stricken former American Marine on vacation in the Philippines becomes the prime suspect in a series of murders of his romantic partners.,Gregory Segal
tt3862744,Kempe Gowda 2,2019,,139 min,"Action, Thriller",8.4,A police officer discovers a political conspiracy surrounding the elections and becomes the target for goons and powerful politicians.,Shankar Gowda
tt17543886,Who Am I,2022,,50 min,"Drama, Mystery, Thriller",8.4,"Who Am I is a feature film which is based on schizophrenia's patient. Its a thrill,crime and suspense film. The main lead of the film is character Ali. The film is brought you by Sky Line Films which is Pakistani Based production company.","Shehroz Gujjar, 
Asad Khan"
tt2147008,Swan Lake,2012,PG-13,120 min,"Drama, Fantasy, Music",8.4,"A modern interpretation of Tchaikovsky's classic tale of love, caution and fidelity.","Ross MacGibbon, 
Matthew Bourne"
tt11108348,Used,2019,,57 min,"Drama, Thriller",8.4,Relationship of two sisters entangled them in a dangerous game.,Paresh Vinodray Savani
tt3169652,Aa Dinagalu,2007,,136 min,"Crime, Drama, Romance",8.4,"Based on the non-fictional novel ""Dadagiri Dinagalu"", an affluent youth is dragged into the 1980s Bangalore underworld to save his love from his conspiring father.",K.M. Chaitanya
tt11985484,Man,2022,,72 min,Thriller,8.4,"Tortured by his inability to feel emotional or physical pain, a man finds murder to be his only respite - until he meets a lonely woman whose compassion awakens something inside.",Tzvi
tt9332398,Believe in You,2020,,120 min,"Adventure, Drama, Musical",8.4,"A contemporary thriller drama based on real-life event, a music producer determined to help young talents achieve their dream crosses path with an estranged female artist struggling to survive an abusive relationship.",Isioro Tokunbo Jaboro
tt9037854,Loss of Grace,2020,,98 min,Thriller,8.4,"Still mourning the mysterious disappearance of his young daughter three years before, a police officer happens upon a seemingly-uncooperative homeless man in an alleyway who might hold the answers he so desperately seeks.",Arun Konda
tt13231270,Nirbandham,2020,,83 min,"Crime, Thriller",8.4,The movie delves into the psychology of rapists while also depicting the heart wrenching darker aspects brought out by the lockdown during coronavirus pandemic.,Bandi Saroj Kumar
tt12598848,Toxic Desire: Addiction,2014,,91 min,Thriller,8.4,"A Psychiatrist with painful past, has witnessed his wife killed herself because she was raped. He suffered insomnia until he meets a beautiful girl. but every man who loved her has died mysteriously and she is a suspect in their murders.",Yoon Yeo-Chang
tt15454148,The Wisteria Manor,2022,,53 min,"Mystery, Thriller",8.4,"At times Heaven can open wide and release the souls wanting to find their way to where they once stood. Set in Ohio in 1851, this story reveals a family's secrets hidden for generations.",Michelle Arthur
tt3453938,Room 236,2015,,120 min,"Drama, Thriller",8.4,Add a Plot,"Armin Alic, 
Wilfredo Torres"
tt21047686,Vaade Veedu,2022,,120 min,"Crime, Thriller",8.4,VaadeVeedu is a most Romantic suspense thriller film. Series of unfortunate events occur when a husband is deceived by his wife. His only mistake was to trust and love her passionately.,Korukonda Gopi Krishna
tt24069594,Pasivadi Pranam,2022,,130 min,"Crime, Drama, Horror",8.4,"In a twisted world, a husband kills his wife by accident and buries her in the backyard. His life becomes miserable when his house becomes haunted.",N.S. Murthy
tt16410596,Maa Oori Polimera,2021,,138 min,Thriller,8.4,Add a Plot,Anil Viswanath
tt0814318,Siete muertes a plazo fijo,1950,,88 min,"Comedy, Thriller",8.4,"On New Year's Eve, a banker and his wife invite several friends to have dinner in their apartment. Suddenly, an astrologer makes an appearance and predicts seven of the present people will die in the next weeks.",Manolo Alonso
tt0963947,Sacred Game,2009,,,"Horror, Thriller",8.4,"SACRED GAME is the moment between life and death. In the midst of fleshing out his latest screenplay, Daniel decides on leaving his wife and infant son to escape for a weekend hunting ...                See full summary »",Bernardo Chilindron
tt7151428,Yeda,2013,,,Thriller,8.4,"Psychic Brahmin Appa harasses his wife Savitri and insists that his son Unmesh marry a rich girl to recover his education expenses. However, Unmesh loves Pradnya and flees with her fearing his father's wrath.",Kishor Pandurang Belekar
tt9795264,Risknamaa,2019,,123 min,Thriller,8.4,"Sher Singh is the Sarpanch of his village. Whose same order for all, that whoever loves, will get the death punishment only. In this way Sher Singh has killed so many boys and girls, who ...                See full summary »",Aarun Nagar
tt9464770,Unfriends,2019,,104 min,Thriller,8.4,Unfriends Hindi Movie is a story of a Girl who is befriended by an unknown person of a violent character. How a boy a good Samaritan helps her get through her fight against cyber crime and ...                See full synopsis »,Ashfaque Shaikh
tt3539342,Chintoo 2: Khajinyachi Chittarkatha,2013,,,"Family, Thriller",8.4,"Chintoo, a sweet but notorious boy, and his friends attempt to find ways to get back their playground from a local thug named Guru.",Shrirang Godbole
tt17425056,Stop Watch,2022,,86 min,"Crime, Thriller",8.4,"Jay is a popular businessman, whose wife (Harika) mysteriously goes missing. Yogi is a lawyer hired by the victim's family. Based on the evidence found by the Forensic Department, Yogi ...                See full summary »",Bharat Varma Kakarlapudi
tt12995706,Under the Crystal Dome,2019,,60 min,Thriller,8.4,Thomas Burke is found in a dark forest where he was looking for his lost son. One year later the psychiatrist Andrew Owens finds out this case dragging him into the deepest depths of his ...                See full summary »,Cristian Parras
tt4518284,The Last Love Letter,2015,,110 min,Thriller,8.4,"Steve Brody hides a dark secret from his childhood that seems to follow him into his adulthood , no matter how hard he tries it seems to affect his life in the present until one fateful day...                See full summary »",Simon Jake
tt3556394,Dora's Peace,2016,,85 min,"Action, Crime, Drama",8.4,"Dora, a Hillbrow prostitute shields a gifted young boy from the violent clutches of organized crime. In the process she may discover aspects of her own lost humanity.",Konstandino Kalarytis
tt2297067,Winter's Kill,2012,,,"Action, Horror, Thriller",8.4,"Without electricity, gas, and food only in short supply, six groups of survivors must battle themselves and others in an attempt to prepare for the upcoming winter.","Dylan J. Freedman, 
Ryan L. Johnson"
tt0213997,Perry Mason Mysteries,1993,,,"Crime, Thriller",8.4,Add a Plot,Kathryn Christopher
tt10400198,The Sound of the Wind,2020,,84 min,"Drama, Mystery, Thriller",8.4,"A suspenseful, slow-burning, psychological thriller about a young man whose paranoia has him torn between the pain of abandoning his daughter and the safety of his own life. A bag of money, a tumultuous chase and a story of man vs. self.",Jared Douglas
